{
  "version": "foliage-unit-0.1.0",
  "seed": 17,
  "support": {
    "id": "rf1:virtual-00",
    "parent_branch_id": "rf1:synthetic",
    "parent_t": 0,
    "terminal": true,
    "region": "unit-study",
    "points_m": [[0, 0, 0], [0, 0, 0.65]]
  },
  "parameters": {
    "variant": "folded-hex",
    "leaf_length_m": 0.18,
    "width_ratio": 0.6,
    "spacing_m": 0.09,
    "azimuth_step_deg": 137.5,
    "inclination_deg": 65,
    "roll_deg": 8,
    "fold_deg": 25,
    "jitter_deg": 12,
    "scale_jitter": 0.15
  }
}
